,Positions,Locations,Categories
0,Customer Success Manager,San Francisco,Customer Success
1,Senior Customer Success Manager,San Francisco,Customer Success
2,DevOps Engineer,San Francisco or Remote,Engineering
3,Senior Machine Learning Engineer,San Francisco,Engineering
4,"Senior Software Engineer, Frontend",San Francisco or Remote,Engineering
5,"Senior Software Engineer, Fullstack",San Francisco or Remote,Engineering
6,"Staff Software Engineer, Backend",San Francisco,Engineering
7,"Staff Software Engineer, Fullstack",San Francisco or Remote,Engineering
8,Don't see your role here?,San Francisco or Remote,Labelbox
9,Inbound Sales Development Representative,San Francisco or Remote,Marketing
10,Senior Technical Recruiter,San Francisco,Operations
11,Outbound Sales Development Representative,San Francisco,Sales
