,Positions,Locations,Categories
0,Dedicated Support Engineer (Italy),Milan,EMEA – Cloud Managed Services (Italy)
1,Technical Support Consultant (Gurgaon),Gurgaon,INDIA – Cloud Managed Services (Gurgaon)
2,Service Delivery Manager (Vilnius),Vilnius,Lithuania – Cloud Managed Services (Vilnius)
3,Support Engineer (Vilnius),Vilnius,Lithuania – Cloud Managed Services (Vilnius)
4,Technical Support Consultant (Vilnius),Vilnius,Lithuania – Cloud Managed Services (Vilnius)
5,Application Security Engineer (Vilnius),Vilnius,"Lithuania – IT, Innovation and Support (Vilnius)"
6,"Marketing Intern (Bellevue, WA)","Bellevue, WA",USA – Marketing (Bellevue)
7,"Product Manager Intern (Bellevue, WA)","Bellevue, WA",USA – Marketing (Bellevue)
8,"Technical Account Manager (Cincinnati, OH)","Cincinnati, OH",USA – Sales (USA)
